connection_id,obj_name,direction,activity_type,rel_type,country,gender,comment
0,bath tube,from,giving,family,usa,man,"We didn't have anything [as kids]. We couldn't afford anything. So now that we can, I find it difficult to find a balance."
1,cadle bed,from,presenting,friends,usa,woman, More comments in here .....anything [as kids]. We couldn't afford anything. So now that we can I find it difficult....
2,diapers,from,presenting,playground friends,pl,man, can we have some more . ..adas TESt test und so on... 
3,kids baby clothes,from,buySell,family,uk,woman, here is another comment for u all....
4,money,from,keeping and bringing,family,uk,woman, and the same here - borrowing lenting - lenting borrowing ... never ending story hu
5,various stuff,from,giving,family,uk,man, ab be advised not to use any 'KOMMA' in the comments- otherwise nothing will happen ^^
6,various childrens stuff,from,borrowing and lending,colleague,usa,woman, COMMENTS for the COMMENTS - COMMENTS for the COMMENTS - COMMENTS for the COMMENTS - COMMENTS for the COMMENTS....
7,various stuff,from,buying and selling,family,pl,woman, here we go "COMMENTs-UNIVERSE"